{
  "id": "feedback_2026-01-15T120000Z_001",
  "created_at": "2026-01-15T12:00:00Z",
  "action_brief_ref": "action_brief.synthetic.weekly-focus-001",
  "observed_outcome": {
    "status": "corrected",
    "summary": "The brief identified the right general risk but overstated how current one supporting signal was."
  },
  "correction_summary": "Downgrade the recommendation from immediate action to optional follow-up unless newer evidence appears.",
  "evidence_refs": [
    "synthetic.artifact.project-note-001",
    "synthetic.telemetry.work-session-002"
  ],
  "confidence": 0.72,
  "privacy": "synthetic"
}
